promise_id,party,year,page_number,manifesto_section,promise_text
BJP_2014_0403,BJP,2014,0,Labour & Employment,We will focus on developing skilled human resources for railways.
BJP_2014_0404,BJP,2014,0,Infrastructure,"We will prioritize Safety and invest in overhaul of stressed infrastructure, strict norms and warning systems in railways."
BJP_2014_0405,BJP,2014,0,Infrastructure,We will modernize and equip all stations with requisite infrastructure and public utilities.
BJP_2014_0406,BJP,2014,0,Infrastructure,We will convert all unmanned crossings into manned crossings in a phased manner.
BJP_2014_0407,BJP,2014,0,Infrastructure,"We will initiate R&D for indigenous railways, coach design and signals."
BJP_2014_0408,BJP,2014,0,Infrastructure,We will launch Diamond Quadrilateral project of High Speed Train network (bullet train).
BJP_2014_0409,BJP,2014,0,Rural Development,We will launch the 'Pradhan Mantri Gram Sinchayee Yojana' with a motto of 'har khet ko paani'.
BJP_2014_0410,BJP,2014,0,Rural Development,We will launch multi-pronged 'water strategy' for reducing farmer's dependence on monsoon.
BJP_2014_0411,BJP,2014,0,Rural Development,We will increase irrigated land by completing long pending irrigation projects on priority.
BJP_2014_0412,BJP,2014,0,Energy & Environment,We will nurture ground water recharge harnessing rain water.
BJP_2014_0413,BJP,2014,0,Energy & Environment,"We will encourage efficient use, water conservation, recycling and rain water harvesting."
BJP_2014_0414,BJP,2014,0,Energy & Environment,We will set up Sewage treatment plants to prevent pollution of rivers.
BJP_2014_0415,BJP,2014,0,Energy & Environment,We will set up Desalination plants for drinking water supply in coastal cities.
BJP_2014_0416,BJP,2014,0,Energy & Environment,We will inter-link rivers based on feasibility.
BJP_2014_0417,BJP,2014,0,Energy & Environment,We will examine ground water to eliminate toxic chemicals.
BJP_2014_0418,BJP,2014,0,Health,We will ensure drinking water security to all.
BJP_2014_0419,BJP,2014,0,Energy & Environment,We will encourage setting up of drinking water supply grid in water scarce areas.
BJP_2014_0420,BJP,2014,0,Energy & Environment,"We will promote decentralized, demand-driven, community-managed water resource management."
BJP_2014_0421,BJP,2014,0,Urban Development,We will facilitate piped water to all households.
BJP_2014_0422,BJP,2014,0,Energy & Environment,We will come out with a responsible and comprehensive 'National Energy Policy'.
BJP_2014_0423,BJP,2014,0,Economy & Finance,"We will focus on development of energy infrastructure, human resource development and upgradation of technology."
BJP_2014_0424,BJP,2014,0,Energy & Environment,"We will maximize the potential of oil, gas, hydel power, ocean, wind, coal and nuclear sources."
BJP_2014_0425,BJP,2014,0,Energy & Environment,We will set up small-hydro power generation projects.
BJP_2014_0426,BJP,2014,0,Energy & Environment,We will increase domestic coal exploration and production.
BJP_2014_0427,BJP,2014,0,Energy & Environment,We will expedite oil and gas explorations.
BJP_2014_0428,BJP,2014,0,Energy & Environment,We will give a thrust to renewable sources of energy.
BJP_2014_0429,BJP,2014,0,Energy & Environment,We will expand and strengthen the national solar mission.
BJP_2014_0430,BJP,2014,0,Education,We will create an ecosystem for fundamental research and innovation in science and technology.
BJP_2014_0431,BJP,2014,0,Energy & Environment,"We will ensure food, agricultural, nutritional, environmental, wealth, health and energy security using science and technology."
BJP_2014_0432,BJP,2014,0,Health,"We will mount a direct and sustained effort on alleviation of poverty, enhancing livelihood security, removal of hunger and malnutrition using scientific capabilities."
BJP_2014_0433,BJP,2014,0,Economy & Finance,We will encourage research and innovation in areas of relevance for the economy and society.
BJP_2014_0434,BJP,2014,0,Energy & Environment,We will encourage research and application to meet challenges of climate change and natural hazards.
BJP_2014_0435,BJP,2014,0,Foreign Policy,We will promote international science and technology cooperation.
BJP_2014_0436,BJP,2014,0,Youth & Sports,We will devise schemes to encourage youth to take scientific research and innovation as a career.
BJP_2014_0437,BJP,2014,0,Youth & Sports,We will provide work environment and professional opportunities in fundamental scientific research.
BJP_2014_0438,BJP,2014,0,Education,"We will build world class regional centres of excellence in nanotechnology, material sciences, thorium technology and brain research."
BJP_2014_0439,BJP,2014,0,Foreign Policy,We will create an ecosystem for multi-country and inter-disciplinary collaborative research.
BJP_2014_0440,BJP,2014,0,Governance & Anti-Corruption,We will establish an Intellectual Property Rights Regime.
BJP_2014_0441,BJP,2014,0,Economy & Finance,We will achieve synergy between industry and scientific research by creating autonomous technology transfer organizations.
BJP_2014_0442,BJP,2014,0,Economy & Finance,We will promote innovation by creating a comprehensive national system of innovation.
BJP_2014_0443,BJP,2014,0,Rural Development,We will develop and harness indigenous knowledge for wealth and employment generation.
BJP_2014_0444,BJP,2014,0,Education,We will promote science popularization schemes extensively.
BJP_2014_0445,BJP,2014,0,Education,We will bring changes in secondary education to focus on application of science.
BJP_2014_0446,BJP,2014,0,Labour & Employment,We will set an institute of Big data and Analytics.
BJP_2014_0447,BJP,2014,0,Health,We will do research for the eradication of tropical diseases.
BJP_2014_0448,BJP,2014,0,Rural Development,We will establish institutes of Technology for Rural Development.
BJP_2014_0449,BJP,2014,0,Education,We will establish a Central University dedicated to Himalayan Technology.
BJP_2014_0450,BJP,2014,0,Energy & Environment,"We will promote research and application of nuclear science in medicines, industry and agriculture."
BJP_2014_0451,BJP,2014,0,Energy & Environment,We will encourage Cleaner production.
BJP_2014_0452,BJP,2014,0,Energy & Environment,We will promote Cleaner fuels to bring down pollution levels.
BJP_2014_0453,BJP,2014,0,Energy & Environment,We will promote the concept of pro-active 'Carbon Credit'.
BJP_2014_0454,BJP,2014,0,Energy & Environment,We will conduct Ecological Audit of projects and pollution indexing of cities and townships.
BJP_2014_0455,BJP,2014,0,Energy & Environment,We will set up pollution control mechanisms on priority basis.
BJP_2014_0456,BJP,2014,0,Energy & Environment,We will use wastelands of the country for social forestry.
BJP_2014_0457,BJP,2014,0,Energy & Environment,We will bring out Guidelines for Green buildings and energy efficient work places.
BJP_2014_0458,BJP,2014,0,Energy & Environment,We will promote R&D and Human Resource Development in Environment Technology.
BJP_2014_0459,BJP,2014,0,Energy & Environment,We will set up fool proof mechanisms for protection and preservation of wild life.
BJP_2014_0460,BJP,2014,0,Energy & Environment,"We will encourage citizen's participation in reforestation, agro-forestry and social forestry."
BJP_2014_0461,BJP,2014,0,Energy & Environment,We will encourage and incentivize innovative garbage disposal and waste management practices.
BJP_2014_0462,BJP,2014,0,Energy & Environment,We will launch 'National Mission on Himalayas'.
BJP_2014_0463,BJP,2014,0,Energy & Environment,We will create a 'Himalayan Sustainability Fund'.
BJP_2014_0464,BJP,2014,0,Energy & Environment,We will give due Importance to programmes devised to arrest the melting of Himalayan glaciers.
BJP_2014_0465,BJP,2014,0,Economy & Finance,"We will set in place national policies on critical natural resources like coal, minerals, spectrum."
BJP_2014_0466,BJP,2014,0,Governance & Anti-Corruption,We will take State Governments into confidence for harnessing of these resources.
BJP_2014_0467,BJP,2014,0,Economy & Finance,We will implement auction of precious resources through efficient mechanisms including e-auction.
BJP_2014_0468,BJP,2014,0,Energy & Environment,"We will undertake Resource mapping, exploration and management through the use of technology."
BJP_2014_0469,BJP,2014,0,Economy & Finance,We will encourage value addition in all resources.
BJP_2014_0470,BJP,2014,0,Defence & Security,We will revive the anti-terror mechanism and strengthen the role of NIA.
BJP_2014_0471,BJP,2014,0,Governance & Anti-Corruption,We will put a system in place for swift and fair trial of terror related cases.
BJP_2014_0472,BJP,2014,0,Defence & Security,We will reform the National Security Council to make it the hub of all sector-related assessments.
BJP_2014_0473,BJP,2014,0,Governance & Anti-Corruption,We will insulate intelligence agencies from political intervention and interference.
BJP_2014_0474,BJP,2014,0,Defence & Security,We will completely revamp the intelligence gathering system by modernizing the intelligence department.
BJP_2014_0475,BJP,2014,0,Defence & Security,We will provide State governments with all assistance to modernize their respective police forces.
BJP_2014_0476,BJP,2014,0,Defence & Security,We will strengthen and expand the Civil Defence and Home Guards mechanism.
BJP_2014_0477,BJP,2014,0,Youth & Sports,We will encourage and strengthen NCC training at the college and University level.
BJP_2014_0478,BJP,2014,0,Defence & Security,We will chalk a national plan to address challenges posed by Maoist insurgency.
BJP_2014_0479,BJP,2014,0,Governance & Anti-Corruption,We will take urgent steps for the safety of migrant workers and communities from the Northeast and other states.
BJP_2014_0480,BJP,2014,0,Defence & Security,"We will address the issue of reforms with regards to defence equipment, support services, and organizational reforms."
BJP_2014_0481,BJP,2014,0,Defence & Security,We will address the increasing shortage of commissioned and non-commissioned staff in the defence forces.
BJP_2014_0482,BJP,2014,0,Labour & Employment,"We will implement one rank, one pension."
BJP_2014_0483,BJP,2014,0,Defence & Security,We will build a War Memorial to recognize and honour the gallantry of soldiers.
BJP_2014_0484,BJP,2014,0,Defence & Security,We will take measures to make Short Service Commission more attractive.
BJP_2014_0485,BJP,2014,0,Infrastructure,We will set up the National Maritime Authority.
BJP_2014_0486,BJP,2014,0,Defence & Security,We will modernize armed forces and increase R&D in defence.
BJP_2014_0487,BJP,2014,0,Defence & Security,We will fast track defence purchases.
BJP_2014_0488,BJP,2014,0,Defence & Security,We will deal with cross border terrorism with a firm hand.
BJP_2014_0489,BJP,2014,0,Defence & Security,We will review and improve border management and introduce punitive measures to check illegal immigration.
BJP_2014_0490,BJP,2014,0,Defence & Security,We will set up four dedicated defence universities.
BJP_2014_0491,BJP,2014,0,Defence & Security,We will appoint a Veterans Commission to address grievances of veterans.
BJP_2014_0492,BJP,2014,0,Defence & Security,We will ensure greater participation of Armed Forces in the decision-making process of the Ministry of Defence.
BJP_2014_0493,BJP,2014,0,Defence & Security,We will improve the efficiency of Armed Forces Tribunals and minimize appeals by the Government.
BJP_2014_0494,BJP,2014,0,Defence & Security,We will ensure servicemen can register and vote from their place of posting.
BJP_2014_0495,BJP,2014,0,Defence & Security,We will initiate the process of digitization of defence land.
BJP_2014_0496,BJP,2014,0,Defence & Security,We will strengthen the DRDO.
BJP_2014_0497,BJP,2014,0,Defence & Security,"We will encourage private sector participation and investment, including FDI in selected defence industries."
BJP_2014_0498,BJP,2014,0,Defence & Security,We will encourage technology transfer in defence manufacturing.
BJP_2014_0499,BJP,2014,0,Defence & Security,We will find solutions to problems hampering the growth of the defence sector.
BJP_2014_0500,BJP,2014,0,Defence & Security,We will encourage domestic industry to have a larger share in design and production of military hardware.
BJP_2014_0501,BJP,2014,0,Defence & Security,We will study in detail India's nuclear doctrine and revise and update it.
BJP_2014_0502,BJP,2014,0,Defence & Security,We will maintain a credible minimum deterrent.
BJP_2014_0503,BJP,2014,0,Energy & Environment,We will invest in India's indigenous Thorium Technology Programme.
BJP_2014_0504,BJP,2014,0,Foreign Policy,We will reboot and reorient foreign policy goals to locate India's global strategic engagement in a new paradigm.
BJP_2014_0505,BJP,2014,0,Foreign Policy,We will mend equations through pragmatism and a doctrine of mutually beneficial relationships.
BJP_2014_0506,BJP,2014,0,Foreign Policy,We will champion uniform international opinion on issues like Terrorism and Global Warming.
BJP_2014_0507,BJP,2014,0,Foreign Policy,We will engage proactively with countries in the neighbourhood and beyond.
BJP_2014_0508,BJP,2014,0,Foreign Policy,We will pursue friendly relations in the neighbourhood and take strong stand where required.
BJP_2014_0509,BJP,2014,0,Foreign Policy,We will work towards strengthening Regional forums like SAARC and ASEAN.
BJP_2014_0510,BJP,2014,0,Foreign Policy,"We will continue dialogue and cooperation with global forums like BRICS, G20, IBSA, SCO and ASEM."
BJP_2014_0511,BJP,2014,0,Foreign Policy,We will encourage States to play a greater role in diplomacy.
BJP_2014_0512,BJP,2014,0,Foreign Policy,We will expand and empower the pool of diplomats.
BJP_2014_0513,BJP,2014,0,Foreign Policy,"We will harness NRIs, PIOs and professionals settled abroad for strengthening Brand India."
BJP_2014_0514,BJP,2014,0,Social Justice & Minorities,We will remain a natural home for persecuted Hindus and welcome them to seek refuge.
BJP_2014_0515,BJP,2014,0,Governance & Anti-Corruption,We will explore all possibilities within the framework of the constitution to facilitate the construction of the Ram Temple in Ayodhya.
BJP_2014_0516,BJP,2014,0,Foreign Policy,We will take into consideration the cultural heritage and strategic importance of Ram Setu while taking any decision on 'Sethu-Samudram Channel' project.
BJP_2014_0517,BJP,2014,0,Energy & Environment,"We will ensure the cleanliness, purity and uninterrupted flow of the Ganga on priority."
BJP_2014_0518,BJP,2014,0,Energy & Environment,We will launch a massive 'Clean Rivers Programme' across the country driven by people's participation.
BJP_2014_0519,BJP,2014,0,Rural Development,We will strengthen and empower the Department of Animal Husbandry for the protection and promotion of cow and its progeny.
BJP_2014_0520,BJP,2014,0,Rural Development,We will create necessary legal framework to protect and promote cow and its progeny.
BJP_2014_0521,BJP,2014,0,Rural Development,We will set up a National Cattle Development board to implement a Programme for the improvement of indigenous livestock breeds.
BJP_2014_0522,BJP,2014,0,Infrastructure,We will provide appropriate resources for the maintenance and restoration of all national heritage sites.
BJP_2014_0523,BJP,2014,0,Governance & Anti-Corruption,We will initiate digitization of archives and archeological and museological records.
BJP_2014_0524,BJP,2014,0,Urban Development,We will launch a National Mission for beautifying and improving infrastructure and amenities at pilgrimage centres of all faiths.
BJP_2014_0525,BJP,2014,0,Social Justice & Minorities,We will promote Indian languages and put measures for the development of all Indian languages.
BJP_2014_0526,BJP,2014,0,Social Justice & Minorities,We will draft a Uniform Civil Code drawing upon the best traditions and harmonizing them with modern times.
